{
  "$schema": "http://json-schema.org/draft-07/schema#",
  "title": "Omega swarm wave manifest",
  "description": "Coordinator-written pre-assignment of samples (or, for work outside any sample, board items) to sessions. tools/swarm/launch.py validates this shape by hand; this schema documents it and serves as a test fixture.",
  "type": "object",
  "required": ["wave", "max_acu_limit", "bypass_approval", "resumable", "tags", "owner_label_prefix", "exclusions", "sessions"],
  "additionalProperties": false,
  "properties": {
    "wave": {"type": "string", "description": "Wave identifier used in titles, tags, and build/swarm/<wave>/ output.", "pattern": "^[A-Za-z0-9._-]+$"},
    "max_acu_limit": {"type": "integer", "minimum": 1, "description": "Per-session ACU cap passed as max_acu_limit."},
    "devin_mode": {"type": ["string", "null"], "enum": ["normal", "fast", "lite", "ultra", "fusion", null], "description": "Only per-session knob; the model cannot be chosen; null means the org default mode. Omitted from the request when null."},
    "secret_ids": {"type": "array", "items": {"type": "string", "minLength": 1}, "description": "Optional Devin organization secret ids injected as environment variables into every session of the wave (e.g. [\"TYPESAFE_API_KEY\"] enables the Jev test-selection augment on cloud VMs). Values never appear in prompts, receipts, or transcripts."},
    "bypass_approval": {"type": "boolean"},
    "resumable": {"type": "boolean"},
    "tags": {"type": "array", "items": {"type": "string"}},
    "owner_label_prefix": {"type": "string", "description": "Landing owner label prefix; sessions land as <prefix>-<session name>."},
    "exclusions": {"type": "array", "items": {"type": "string"}, "description": "Items or sessions excluded from this wave for current conflicts or blockers, not standing reservations for future waves."},
    "sessions": {
      "type": "array",
      "minItems": 1,
      "items": {
        "type": "object",
        "required": ["name", "host", "owning_paths"],
        "oneOf": [
          {"required": ["sample"], "not": {"anyOf": [{"required": ["board"]}, {"required": ["item"]}]}},
          {"required": ["board", "item"], "not": {"required": ["sample"]}}
        ],
        "additionalProperties": false,
        "if": {"required": ["work_classification"], "properties": {"work_classification": {"required": ["kind"], "properties": {"kind": {"const": "non_semantic"}}}}},
        "then": {"properties": {"work_classification": {"required": ["reason"]}, "semantic_contracts": {"maxItems": 0}}},
        "else": {"required": ["source_revision", "semantic_contracts"], "properties": {"semantic_contracts": {"minItems": 1}}},
        "properties": {
          "name": {"type": "string", "pattern": "^[a-z0-9][a-z0-9-]*$"},
          "sample": {"type": "string", "pattern": "^samples/", "description": "A runnable samples/ project whose main.omg header states `Expected exit` or `Expected output contains`. The session's acceptance is that sample running with its oracle on main; its path is the claimed item. The default kind of session."},
          "board": {"type": "string", "enum": ["TASKS.md", "TASKS_BOOTSTRAP.md", "TASKS_OPTIMIZER.md"], "description": "Only for work outside any sample (release, bootstrap or optimizer acceptance)."},
          "item": {"type": "string", "description": "Board item name; must appear as **<item>.** in the board file."},
          "host": {"type": "string", "enum": ["linux", "local"], "description": "linux: a Devin Cloud session (plan/launch/status/report). local: an agent spawned by the coordinator on this machine in a Git worktree (the `local` subcommand)."},
          "owning_paths": {"type": "array", "minItems": 1, "items": {"type": "string"}, "description": "Repository-relative paths this session owns; no two sessions in the same layer may share one."},
          "work_classification": {"type": "object", "required": ["kind"], "properties": {"kind": {"enum": ["semantic", "non_semantic"]}, "reason": {"type": "string", "minLength": 1}}, "description": "Defaults to semantic. Genuine non-semantic work requires an explicit reason."},
          "source_revision": {"type": "string", "pattern": "^[0-9a-f]{40}$", "description": "Recorded canonical source revision for focused passages."},
          "semantic_contracts": {"type": "array", "items": {"type": "object", "required": ["implementation", "contract", "classification", "reason", "passages"], "properties": {"implementation": {"type": "array", "minItems": 1, "items": {"type": "string"}}, "contract": {"type": "string", "pattern": "^wiki/spec/"}, "classification": {"enum": ["missing_implementation", "owner_decision"]}, "reason": {"type": "string", "minLength": 1}, "passages": {"type": "array", "minItems": 1, "items": {"type": "string", "minLength": 1, "maxLength": 2000}}, "authorization": {"type": "string", "minLength": 1}}}},
          "semantic_handoff_role": {"enum": ["implementation", "review", "continuation"], "default": "implementation"},
          "previous_semantic_handoff": {"type": "object", "description": "Saved prior packet. Launcher reinjects focused passages because a supplied packet alone does not prove retained delivery."},
          "layer": {"type": "integer", "minimum": 0, "default": 0, "description": "Dependency layer: the coordinator launches layer N only after layer N-1 has fully landed or parked. Overlap is only rejected inside one layer; a later layer may own paths an earlier layer touched."},
          "suggested_first_slice": {"type": "string", "description": "Optional hint rendered as a suggestion; the board item's acceptance governs."},
          "host_gates": {"type": "array", "minItems": 1, "items": {"type": "string", "minLength": 1}, "description": "Environment/access and prerequisite checks that must pass before assignment. Expected-red customer acceptance belongs on the board or in suggested_first_slice, not here."},
          "probe_only": {"type": "boolean", "default": false, "description": "Explicit feasibility investigation: verification_only is a planned outcome and failing host_gates are recorded. Cross-stage scope or expected-red customer acceptance alone does not warrant this mode."}
        }
      }
    }
  }
}
